id	path	line_or_heading	category	description	translation_policy	status	evidence_commit	reviewer	notes
SRC-001	Act III - The Broken Land/Arc N - Tales of Vallaki.md	whole file	empty-source	The source file is an empty placeholder.	Skip until upstream supplies content; do not invent an arc.	open	990da1308c1e5ac9f8627048b7f8606c960f3841	initial-domain-audit	Manifest status is skipped.
SRC-002	Act IV - Secrets of the Ancient/Arc T - The Three Fanes.md	opening notice	living-source	The file explicitly announces pending revisions.	Translate only against the pinned blob; mark stale if the baseline changes.	open	990da1308c1e5ac9f8627048b7f8606c960f3841	initial-domain-audit	
SRC-003	Introduction/A DM's Guide to Curse of Strahd.md	TOC	stale-navigation	The introduction labels Act IV Summary and Epilogue as coming soon although populated files exist.	Translate the visible source faithfully unless the source is corrected upstream; do not silently rewrite project status.	open	990da1308c1e5ac9f8627048b7f8606c960f3841	initial-domain-audit	
SRC-004	Introduction/A DM's Guide to Curse of Strahd.md	introduction	continuity	The introduction says six narrative acts while Adventure Summary presents five headings and Arc U has mixed Act IV/Act V treatment.	Preserve source claims within each unit and flag for editorial resolution; do not harmonize by guesswork.	open	990da1308c1e5ac9f8627048b7f8606c960f3841	initial-domain-audit	
SRC-005	Act IV - Secrets of the Ancient/Arc U - Dreams of Dawn.md	line 762	malformed-markup	The source contains class="ciation".	Preserve the attribute byte-for-byte; translate only visible content.	open	990da1308c1e5ac9f8627048b7f8606c960f3841	initial-domain-audit	
SRC-006	multiple	multiple	malformed-markup	The source includes class=description, <Em>, [!Warning], and malformed table rows.	Use a no-regression baseline; never normalize during translation.	open	990da1308c1e5ac9f8627048b7f8606c960f3841	initial-domain-audit	
SRC-007	Act IV - Secrets of the Ancient/Arc T - The Three Fanes.md	visible prose	typo	Known visible typos include “every creature in Barovian” and “Moste High Priest.”	Render the evident intended meaning naturally in Russian without changing technical content; note uncertainty if context does not resolve it.	open	990da1308c1e5ac9f8627048b7f8606c960f3841	initial-domain-audit	
